Authors,Title,Publication,Volume,Number,Pages,Year,Publisher
"Oak, Acorns Flax; Pansy, Amaryllis Four O’Clock; Peach, Apricot Foxglove; Peony, Autumn Crocus Meadow Crocus Holly; Philodendron, Avocado Horse Chestnuts; Poinsettias, Azalea Hyacinth; Hemlock, Baneberries Hydrangea Poison; Oak, Black Locust Iris Poison; Plant, Boxwood Jimson Weed Pothos; Privet, Buckeye Jonquil; ",Toxic Plants for Pet Birds,,,,,,
"TOMATO, FRUIT QUALITY ATTRIBUTING TRAITS IN; Alam, Sadia Sabrina; Ivy, Nasrin Akter; Mian, MA Khaleque; Rahman, M Mizanur; Alam, Faridul; ",Journal Homepage:-www. journalijar. com,,,,,,
"TOMATO, AMATEUR; HEARD, BYMANWHO; MAN, AS SEEN BY LITTLE; CAN, PRIVATE; MAKER, SANDWICH; PROVERB, OFOLD; CAN, LIVING IN BEER; ","to taste better! to™ h, m.^ xstj",,,,,,
"TOMATO, ANTIOXIDANT PROFILING OF SELENIUM FORTIFIED; ",INTERNATIONAL RESEARCH JOURNAL OF PHARMACY,,,,,,
"TOMATO, ASSOCIATED TO SPECIALIZED METABOLISM IN; ",TOMATO FLESHY FRUIT QUALITY IMPROVEMENT,,,,,2015,
"Holm, Reinhardt; ",Elementary School,,,,,1966,
"not Cannabinol, Cannabis Leaves; Wine, Hotel; Tomato, Railway; Statute, Repealed; Fire, Synagogue; ","Mere Baubles, 125'No Case to Answer', 168 Outcome of a Drugs Party, 129 Pervert Course ofJustice, Attempt-ing to, 146",,,,,,HeinOnline
"Sage, Fried; Pesto, Parsley; Sauce, Tomato Pesto; ",Healthiest Herbs,,,,,,
"Avocado, Cucumber; Salad, Grape Tomato; ",DRESSINGS TO IMPRESS,,,,,,
